{
  "id": "council",
  "name": "Council",
  "directorAgentId": "council-chair",
  "purpose": "Runs the decision council: frames the question, convenes 4 perspectives, records the decision.",
  "autonomy": "L1",
  "dataClass": "internal",
  "goalIds": [],
  "status": "active",
  "room": "conference"
}
