{
  "id": "content",
  "name": "Content & Growth",
  "directorAgentId": "dir-content",
  "purpose": "Owns AI video, LinkedIn and blog output. Drafts and stages only; publishing needs human approval.",
  "autonomy": "L1",
  "dataClass": "internal",
  "goalIds": [],
  "status": "active",
  "room": "content"
}
